id,name,description,recommendation
1,ACANTAMOEBA,"đơn bào cơ thể sống, gây ra nhiễm trùng mắt, da, và hệ thống thần kinh trung ương và A nhiễm nghiêm trọng của tủy não và cột sống thường xảy ra ở những người có hệ thống miễn dịch bị tổn hại",
2,ASCARIS LUMBRICOIDES,Một ký sinh trùng giun đũa,
3,ANEMIA,"Thiếu sắt, Khoáng chất và Vitamine B12 trong máu, có thể tạo ra tình trạng mỏi mệt",
4,ATHEROSCLEROSES,Tình trạng xơ cứng tĩnh mạch,Nên bổ sung Omega 3
5,ACCIDENTAL INVOLUTION,"Sự khô khan nơi tuyến giáp, thường gắn liền với lão hóa, sẽ ảnh hưởng tới tiến trình hấp thu thức ăn, dưỡng chất, và có thể mang lại sự sút giảm sức đề kháng hay hệ miễn dịch","Chúng ta cần bồi bổ cơ thể với đạm đậu nành và bổ sung XTRACAL (Can xi) trong bửa ănsáng, tối và lám sạch hóa đường ruột để quá trình trao đổi chất thuận lợi hơn cho cơ thể khỏe mạnh, hấp thu dưỡng chất tốt và tăng sức đề kháng"
6,ACUTE PYELONEPHRITIS,Viêm cấp tính của thận,
7,ACNE,"Gây dị ứng da , ngứa ngáy, có thể thành bệnh mãn tính trên da với những điểm đỏ hay tím.",
8,AMOBEN - PETERLING,Cơ quan đơn bào,
9,ACHRESTIC DIABETES,"Biến chứng bệnh Tiểu đường ảnh hưởng chúc năng của Thận, gây lão hóa nhanh ở nội tạng và các động mạch, tĩnh mạch.",
10,ANCILOSTOMA DUODENALE,"Một loại sán móc gây đau đớn vùng bụng, ăn không thấy ngon miệng, làm tổn hại thành ruột và ảnh hưởng đến tuần hoàn máu trong cơ thể.",
11,ACUTE CATARRHAL CHOLECYSTITIS,Viêm túi mật cấp tính ACU.,
12,PYELONEPHRITIS,Viêm tiết niệu.,"Uống trà năng lượng, và chiết suất Lô hội (Aloe) để thanh lọc cơ thể và đào thãi độc tố."
13,ASPERGILLUS FUMIGATUS,Một loại nấm phủ quanh cuống phổi có thể gây tổn hại đến tuyến hô hấp.,
14,ASPERGILLUS NIGER,Nấm tạo ra độc tố,
15,AQUASPIRILLIUM SERPENS,Bacteria - Một loại vi khuẩn từ nguồn nước,
16,AGE RELATED INVOLUTION,"Những rắc rối liên quan đến lão hóa, hốc môn, và hệ thống bạch cầu, làm suy yếu hệ miễn dịch, sức đề kháng của các tế bào trong người.","Thải độc và bồi bổ cơ thể. Dùng Aloe (Chiết xuất Lô hội), Xtracal (Can xi), và Thermo Tea (Trà Năng lượng) Alveo có tác dụng khữ các kim loại nặng trong máu."
17,ALLERGY,"Những phản ứng quá nhạy cảm với các chất thường gặp trong môi trường dược phẩm không thích ứng với hệ thống miễn dịch. Điều này được tạo ra bởi sự kích hoạt không đúng mức của các kháng thể. Bạn có thể gặp những triệu chứng sau đây: Viêm mủi, Ngứa, hay đỏ mắt hoặc sưng mắt (hội chứng viêm màng kết), Hẹp khí quản, cuốn phổi, thở khò khè hay đứt đoạn, thỉnh thoãng như lên cơn suyễn, cảm thấy ngộp hơi có khi đau nhức trong lổ tai, giảm thính lực bởi nghẽn vòi Ot-lát, Chứng chàm bội nhiễm, nổi mày đay hoặc các trường hợp dị ứng da khác và những cơn nhức đầu lưa thưa.",
18,ANGINA PECTORIS,"Chứng đau thắt ngực do nguồn cung cấp oxygen đến cơ tim không đầy đủ, rất nguy hiểm.",
19,ALLERGIC VASCULITIS,Hội chứng tự động giảm hệ miễn dịch xảy ra khi một trong vài bộ phận của hệ miễn dịch hủy hoại các mô tế bào của chính nó.,
20,ADENOVIRUS,"vi rút trong không khí gây ra bệnh ở đường hô hấp trên và dưới, viêm phế quản, nhiễm trùng mắt, đau xương và khớp, cơ bắp. Tiêu chảy, đau, đau bụng, nhức đầu, sốt,",
21,ADIPOSITY,"Loại virut bay trong không khí gây bệnh cho phần trên và dưới của tuyến hô hấp, làm viêm phế quản. Đau nhức xương , khớp và bắp thịt. Đau ở vùng bụng, nhức đầu và gây sốt.",
22,ALVEOCOCCUS MULTIOCULARIS,Ký sinh trùng,
23,ARRYTHMIA OF THE HEART,"Những nhịp đập bất thường của tim, loạn nhịp",
24,AUTOIMMUNE THYROIDITIS,Một loại bệnh trong đó cơ thể tự sản sinh ra các kháng thể chống lại những hốc môn của tuyến giáp.,
25,BABESIA DIVERGENS,"ký sinh trùng có thể gây nhiễm trùng đường ruột, gan, túi mật,",
26,BACTERIUM LACTIS AEROGENES,"Khuẩn sửa, một loại vi khuẩn có trong Acid Lactic, thường là một phần của siêu vi khuẩn. Nhưng nếu gia tăng dân số của chúng quá mức, sẽ bao phủ nước nhầy ở ruột non và nhân đó làm giảm sự hấp thu của thực phẩm, vitamines và các chất bổ sung. Nếu chúng không dọn dẹp màng nhầy và đồng thời làm viêm tấy phế quản, làm hạn chế dung tích của hai lá phổi, chúng có thể gây nhiểm trùng tuyến tiếp niệu và phá hủy chất lượng của da.",Làm sạch hay khử độc đường ruột.
27,BACTERIUM COLI,Vi khuẩn đường ruột,
28,BACTEROIDES FRAGILIS,Loại vi khuẩn có thể gây nhiểm trùng trong ruột và âm đạo phụ nữ.,
29,BACILLUS CEREUS,"Loại vi khuẩn thải ra độc tố làm tổn hại đến tim, có thể gây ra nôn mữa và tiêu chảy.",
30,BLASTOCYSTIS HOMINIS,"ký sinh trùng sống trong ruột có thể gây tiêu chảy, và làm suy yếu cơ thể",
31,BOSTROOP'S DISEASE,"Bệnh loãng xương, ngang khu vực thắt lưng, những người già thường bị bệnh chứng này.",Dùng Xtracal
32,BORDETELLA PERTUSSIS,Vi khuẩn gây ra ho.,
33,BORELLIA BURGDORFERI,"Vi khuẩn Bollelia được truyền vào người bởi vết thương nhiểm trùng hoặc do muổi đốt, có thể hành sốt, nhức đầu, mệt mỏi, suy nhược cơ thể, bắp thịt hay khớp xương bị đau và da có thể phát ban. Vi khuẩn này gây tổn hại đến khớp xương, tim và hệ thần kinh trung tâm.",
34,BRAIN CONCUSSION,"Chấn động hay choáng não, Đây là dạng nhẹ nhất của chấn thương đầu, nó có thể được gây ra bởi vết thương, hay một cú sốc, tạo ra cảm giác mất phương hướng, sung huyết lên mắt, và gây nôn mữa. Việc tái lập các chấn động có thể dẩn đến những thay đổi ngoài ý muốn, làm giảm trí nhớ, có cảm giác bất an, hay bị kích động, trạng thái thay đổi bất chừng, mắt cảm thấy đau, nhức đầu, và trong người mệt mỏi, chóng mặt người bần thần, khó ngủ. Hoạt động cơ thể bị giảm sút hiệu năng (bởi áp lực tinh thần lẩn thể xác).","Để cho mắt và đầu nghĩ ngơi, đồng thời dùng đủ lượng oxy phục hồi cho não và các mạch máu. Tránh những giao động mạnh, cử tiếng ồn và hãy dùng Niteworks"
35,BRONCHOPNEUMONIA,Vi khuẩn có thể gây tổn hại đến buồng phổi,
36,BRONCHITIS,"Viêm phế quản BRANHAMELLA (NEISSERIA) - Loại ký sinh trùng có thể gây nhiểm trùng đường hô hấp, hư tổn lổ tai trong, mắt, hệ thần kinh trung tâm và khớp.",
37,BURSITIS,"Làm giảm sung lượng, hay phản xạ đầu gối, khớp vai, và hai mông. Đồng thời, ảnh hưởng đến các bắp thịt và gân. Đôi khi có liên quan đến bệnh viêm khớp và Gút.",
38,CALF MUSCLE SPASM,"Bắp thịt bị co rút, một trong những nguyên nhân thường do thiếu chất điện phân trong cơ (đối với vận động viên), đa phần bị chuột rút ở hai chân, nhưng cũng có thể là bất kỳ bắp thịt trơn tru khác trong người.","Tăng cường các chất điện phân, dùng Xtracal."
39,CYTOMEGALOVIRUS,Loại Virus gây tổn hại đến tim và phổi.,"Nên tăng cường sức đề kháng, thải độc tố trong ruột và cơ thể."
40,CANDIDA ALBICANS,"Là một loại ký sinh men, một phần tự nhiên của cơ thể, nhưng nếu quần thể nội tại bắt đầu nhân rộng một cách không kiểm soát được và tạo mảng nhiểm trùng. Loại bỏ chúng ra khỏi người sẽ là một vấn đề lớn. Lớp men này được tìm thấy trong ruột, tuyến tiết niệu, vòm miệng, thực quản và trong cổ họng.",
41,CANDIDA CRIPTOCOCCUS NEOFORMANS,"Nấm, bọt men",
42,CANDIDA MYCOSIS ORIS,"Nhiểm trùng do nấm, có thể gây bệnh chứng trên da.",
43,CANDIDA GLABRATA,"Một loại men tạo ép chế chất kháng nguyên, làm giảm hệ miễn dịch.",
44,CANDIDA SAHAROMYCES,"Loại nấm gây ép chế các kháng thể, suy giảm hệ miễn dịch.",
45,CANDIDA CRIPTOCOCCUS NEOFORMANS,"Những nốt sùi dạng nấm có thể gây nhiểm trùng phổi, tạo ép chế lên các kháng thể làm suy yếu hệ miễn dịch.",
46,CANDIDA CANDIDA ROBUSTA,"Một loại nấm gây ức chế đối với ững kháng thể, làm suy giảm hệ miễn dịch.",
47,CANDIDA PARAPSILOSIS,Loại ký sinh men gây ức chế lên các kháng thể. Hệ miễn dịch có thể bị nhiểm trùng.,
48,CALCULARY CHOLECYSTITIS,Viêm túi mật,
49,CATARRHAL GASTRITIS,Viêm chày dạ dày,
50,CERVITITIS,Viêm cổ tử cung. ,
51,CERVIX UTERI EROSION,"Rối loạn dạ con, sự bào mòn da tử cung.",
52,CLOSTRIDIUM BOTULINUM,vi khuẩn. sản xuất một chất độc,
53,CLONORCHIS SINENSIS,"Ký sinh trùng trong gan, gây nên chứng co giật.",
54,CLONORCHIS VIVERRINI,Thái Lan sán sống trong gan và túi mật của những vùng,
55,CONVULSIVE DISORDER,"Điều này có thể làm rung rẩy hai tay, hoặc bị chuột rút.",
56,CONJUNCTIVITIS,"Viêm màng kết, điều này có thể gây ngứa hay chảy nước mắt.",
57,COLITIS,Viêm ruột kết.,
58,COXSACKIE,"Loại virus tạo viêm màng kết, gây quá tải lên mắt..",
59,CRYPTOSPORIDIUM HOMINIS,"ký sinh trùng gây bệnh đường ruột có thể gây ra các vấn đề dạ dày và đau bụng, tiêu chảy",
60,CYCTOPIELITIS,"Đây là chứng viêm bàng quang, liên quan đến bệnh trong thận. Thông thường chúng được gây ra bởi các virus, vi khuẩn hoặc nấm trong ruột. Những triệu chứng bao gồm đau buốt khi đi tiểu, có máu trong nước tiểu, làm sốt và đau lưng hoặc mông. Có thể người ta không cảm nhận được những triệu chứng và cũng không hề biết chúng tồn tại ngay cả sau khi tiểu hoặc đại tiện.",Dùng chiết suất Lô hội cô đặc và liệu pháp Plasma.
61,DERMATOSIS,"Đây là do cảm ứng bẩm sinh của từng cơ quan đối với vật chất khác nhau trong môi trường, hay còn gọi là dị ứng. Những tính chất dị ứng này sau khi tiếp xúc với cơ thể con người tạo ra các triệu chứng như là hen suyễn, hay viêm mủi.",
62,DEFLECTED NASAL SEPTUM,"Vách ngăn vòm mủi bị lệch. Ảnh hưởng đến tiếng nói, chảy máu cam hay thở một cách khó khăn, rất dể nhiểm trùng.",
63,DIATHESIS,"Gây các rối loạn chẳng hạn như chán nản, dể kích động, tâm thần phân liệt.",
64,DIFFUSE GOITRE,Sưng phù tuyên giáp.,
65,DYSKINESIA,Rối loạn cơ mềm có thể gây sự run rầy cực độ.,
66,DUODENAL ULCER,loét tá tràng,
67,DYSTROPHY,"Tổn hại các tế bào reong cơ thể, ảnh hưởng đến sức chuyển hóa và hấp thu dưỡng chất.",Hãy bồi bổ các cơ quan và thãi độc.
68,DUODENTIS,Viêm tá tràng,
69,DIENTAMOEBA FRAGILIS,Ký sinh trùng có thể gây khó tiêu.,
70,ENTEROCOCCUM,Vi khuẩn có thể gây viêm đường tiết niệu.,
71,ENTERITIS,Viêm ruột non (Gây ra bởi tiêu thụ thức ăn nhiểm khuẩn).,
72,ENTEROCOLITIS,"Tuyến tiêu hóa, ruột non và ruột kết (do những viêm nhiễm khác nhau từ vi khuẩn, virus, nấm và ký sinh trùng)",
74,ENZIMOPATHY,"ENTEROKINASIS DEFICIENCY je enzym střevní sliznice, způsobuje poruchu metabolismu a vstřebavání vitaminu, špatné trávení. Doporuceni Aloe.",
75,ENTEROKINASIS,"Thiếu enzym trong màng nhầy của ruột, gây tổn hại đến tiến trình trao đổi chất và sức hấp thu vitamines.",
77,ENTEROBIUS VERMICULARIS,"Ký sinh trùng, trong ruột non, có thể gây rối loạn giấc ngủ, gây viêm , nhiểm trùng đường, tiết niệu và âm đạo phụ nữ. Ấu trùng theo máu vào đến phổi, gây những cơn ho tại đó và quá trình khạc đờm làm cho nước nhầy được nuốt trở lại vào bụng. Tại phổi ấu trùng lưu lại khoãng 1-2 tuần, sau đó xuống bao tử gây nhiểm trùng ở tuần, thứ ba. Giai đoạn cuối,ấu trùng đến ruột non và khi trưởng thành, lượng ấu trùng di trú từ phổi theo tuần hoàn của máu đến tất cả các cơ quan, thường là gan, thận, ruột, não, các cơ bắp, và ẩn trong những mô da. Tại đây,chúng tụ lại và kết, nang và có thể tồn tại thời gian rất lâu.",liệu pháp Plasma Clarkia và dùng nhiều chất sơ.
78,ENTEROSPASMS,Đây là một cơn đau từ co thắt ruột.,"Khuyến nghị dùng Chiết suất lô hội, Alveo, Các chất sơ và thảo dược."
80,EROSIVE GASTRITIS,Viêm thành bao tử (từ thuốc Tây hay hóa chất).,"Dùng chiết suất Lô hội, Alveo."
81,ENTAMOEBA HISTOLYTICA,Đây là phân tử ký sinh trùng có thể gây tiêu chảy và bệnh chứng ở gan. Lây truyền bởi nguồn thức ăn và nước nhiểm bẩn.,
83,EPIDERMOPHYTON FLOCCOSUM,Một loại nấm,
84,EPSTEIN - BARR VIRUS,Loại virus có thể gây bệnh Mononucleosis,
85,ESCHERICHIA COLI,Vi khuẩn bẩn từ phân.,
86,EXUDATIVE SEROUS SINOVITIS,"Gây ra những tình trạng đau khớp, do có nước trong khớp, thường liên quan đến bệnh viêm khớp hay Gút.","Hãy thãi độc, dùng Xtracall, Alve, và liệu pháp Plasma."
88,FARSIGHTEDNESS,Tật viễn thị,
89,GASTRITIS,Viêm bao tử.,
90,GASTROENTERITIS,Nhiểm trùng đường ruột và viêm bao tử,
91,GOUT,"Có Acid trong khi tiểu, có thể tạo miểng trong thận, đau khớp, các ngón tay, viêm khớp cấp tính và sưng khớp.",
92,GENYANTRITIS,Viêm phần trên của khoang mủi.,
93,HAEMORRHOIES,Bệnh trĩ. Hãy dùng chiết suất Lô hội,
94,HEPATITIS VIRUS,"Virus gây bệnh viêm gan, làm vàng da.",
95,HERPESVIRUS,"Nhóm virus gây bệnh Herpes, bệnh mụn giộp. Khi bệnh phát triển sẽ làm suy yếu hệ miễn dịch, dể lây lan. (infectious mononucleosis)",
97,HELIOBACTER PYROLI,"Vi khuẩn cùng những nguồn bệnh khác có thể gây khó tiêu, chứng ợ nóng, nôn mữa, đau bao tử, viêm cấp tính, dạng viêm tá tràng và loét dạ dày.",
98,HELMINTHIC INVASIONS,Ký sinh trùng gây nhiễm độc ở gan.,
99,HLAMIDIUM,"Vi sinh vật có thể gây nhiễm trùng cho cơ thể. Bệnh diển ra rất âm ỉ, kéo dài, rất khó nhận biết. Dạng vi sinh vật không giống những loại khác, bệnh cũng ít nghiêm trọng hơn.",Liệu pháp Plasma
100,HYMENOLEPIS DIMINUTA,"còn được gọi là sán dây chuột, có thể gây tiêu chảy, nhiễm trùng, làm suy yếu hệ miễn dịch",
101,HYMENOLEPIS NANA,"ký sinh trùng sản xuất ra một chất độc ở trẻ em có thể gây ra giảm cân, làm phá vỡ chức năng đường ruột, đau đầu, mệt mỏi, đau bụng, nôn mửa.",
102,HYPOFERRIC ANEMIA,"Thiếu sắt và vitamine B 12, làm người mệt mõi.",
103,HYPOTENSION,Huyết áp thấp ,
104,HYPERLUTEINISM,"Có trở ngại với chu kỳ trứng rụng, trong một chu kỳ đậu nhiều hơn một trứng, giống như sanh đôi.",
105,HYPEROXALATURIA,"Quá trình chuyển hóa có nhiều bất thường, do đó xảy ra trường hợp thừa, thiếu khoáng chất trong khi tiểu .",
106,HYPERURATURIA,"Thận tồn tại quá nhiều acid uric hay muối trong nước tiểu , có thể tạo ra sạn thận.",
107,HYPERPHOSPHATURIA,Có quá nhiều Phốt phát trong khi tiểu.,
108,HYPOTHYROIDISM,Hốc môn tuyến giáp sản xuất đủ,
109,HYDRONEPHROSIS,"có trong tuyến thượng thận, có thể gây tình trạng đau lưng, sườn, vùng bụng,chân ngứa ran tái đi tái lại.",Tìm cách hổ trợ chức năng của thận và gia tăng lượng nước tiêu thụ.
111,HYPOTONIA,Rối loạn hệ thần kinh của hệ thống vận động,
112,NTERVERTIBRAL OSTEOCHONDROSIS,Bệnh lệch khớp.,
113,DIOPATHIC HYPERTENSIA,"Bệnh thuộc hệ thần kinh gây nhức đầu, tạo áp lực lên não làm nôn mữa, mắc chứng nhìn đôi.",
115,ISCHEMIA,"Bệnh về tim, giảm lưu lượng máu đến cơ tim nhiều nguy cơ nhồi máu cơ tim.","Dùng Omega 3, Niteworks"
116,JODAMOEBA BUETSCHLII,Ký sinh trùng có thể gây khó tiêu.,
117,KINGELLA KINGAE,Loại vi khuẩn làm nhiễm trùng phần trên tuyến hô hấp.,
118,KORONAVIREN,Loại virus gây bệnh phần trên và dưới cuống phổi.,
119,KLEBSIELLA PNEUMONIAE,Vi khuẩn làm viêm phổi.,
120,LAMBLIA - INTESTINALIS,"Loại ký sinh trùng gây khó tiêu và trở ngại cho đường ruột, phá hủy thành ruột non.",
121,LARYNGITIS,"Bệnh nhiểm trùng ở thanh quản, có thể kinh niên hay cấp tính",
122,LEGIONELLA PNEUMOPHILA,Loại vi khuẩn làm hại phổi.,
123,LEPTOSPIRA INTERROGANS,"Loại trùng xoắn móc câu, vi khuẩn nguy hiểm đối với con người.","Liệu pháp Plasma, Clakia."
124,MONONUCLEOSIS,"Đây là bệnh gây ra bởi virus, ảnh hưởng đến các tuyến nội tiết, đặc biệt lá lách, gan và khối u phế quản và vùng xương chẩm. Thường nhất đối với trẻ em mắc bệnh, hình như không có triệu chứng. Các dấu hiệu bao gồm mệt mỏi chung, sốt, viêm họng và xương chẩm sưng to.",
127,MENINGOCOCCUM,,
128,PETERLING,"Bệnh khuẩn cầu não là loại bệnh gây ra bởi vi khuẩn Meningococcal. Nếu không sớm chữa trị sẽ có nhiều nguy cơ tử vong. Chúng có thể xâm nhập hệ tuần hoàn máu và não. Bệnh có thể lây truyền qua tuyến nước bọt hay tiếp xúc lâu với người bệnh. Đây cũng là quả bom nổ chậm nằm tại khu vực mủi và yết hầu, vốn chiếm 15% dân số khỏe mạnh. Vi khuẩn trong máu tãn ra các nơi khác nhau trong cơ thể tấn công vào thận , gan, tim, phổi và mắt.",
129,METAGONIMUS YOKOGAWAI,Ký sinh trùng,
130,MALIGNANT NEOPLASM,Nguyên nhân gây ra nhiễm trùng đường tiết niệu,
131,MYCOPLASMA HOMINIS,Co´thể gây ra nhiễm trùng đường tiết niệ,
132,MICROSPORUM CANIS,Nấm,
133,MUCOR RACEMOSUSM,Nấm,
134,MUCOR FLUOR,Nấm,
135,MUCOR FUNGOIDES,"Bệnh do nấm, có thể gây phát ban da, ngứa",
136,MUCOR MUCEDO,Nấm,
137,MIGRAINES,"Điều kiện thần kinh mãn tính, có thể gây đau đầu",
138,NECATOR AMERICANUS D=0,"362 giun móc, sống trong ruột, làm suy yếu hệ miễn dịch",
139,NEURASTENIA,"Hội chứng mệt mỏi, trạng thái kiệt sức lo lắng, tâm trạng chán nản có thể xảy ra, đau đầu",
140,NEURANGIOSIS,"Mệt mỏi, cảm giác mất sức, đau cơ, rối loạn giấc ngủ",
141,NEURALGIA,"Phá vỡ các sợi thần kinh (đau trong mô thần kinh), tăng độ nhạy cảm của các sợi thần kinh",
142,NEPHROLITHIASIS,Kidney stones,
143,NEPHRNEISSERIA GONORRHOEAE,Nó là một loại vi khuẩn lây truyền qua đường tình dục và có thể gây nhiễm trùng nguy hiểm cơ quan sinh dục nữ.,
145,NEPHROPTOSIS,"NỔI thận và có thể gây ra đau, buồn nôn",
146,NOCARDIA ASTEROIDES,Nhiễm trùng phổi,
147,NODULAR TOXIC GOITER,Các chất độc hại trong tuyến giáp,
148,OSTEOPOROSIS,Kiến nghị loãng xương: Calcium,
149,OPISTHORHIS FELINEUS,"Ký sinh trùng nhiễm gan ảnh hưởng đến chức năng của gan, tuyến tụy, túi mật, đường mật, gây ra buồn nôn, phát ban da, rối loạn tiêu hóa và bệnh thiếu máu.",
150,OTITIS,"Viêm tai giữa, có thể gây đau, nhức đầu, nôn",
151,PAROXYSMAL TACHYCARDIA,Rối loạn nhịp tim.,
152,OPTIC NERVE NEURITIS,Viêm dây thần kinh thị giác,
153,OPTIC ATROPHY,"Mất mát của mô thần kinh. Trong số những nguyên nhân chủ yếu là suy giảm thị lực, tầm nhìn màu sắc và nhận thức về ánh sáng.",
154,OVARIAN CYST,"Tích tụ của chất lỏng trong buồng trứng, gây đau và chảy máu",
155,PAROXYSMAL TACHYCARDIA,Tăng nhịp tim,
156,PAROTITIS,priusnice,
157,PAPILLOMAVIRUS,"Chủ trương diệt tế bào, DNA, có thể phát triển các mụn cóc, gây ra ung thư cổ tử cung",Khuyến cáo tăng khả năng miễn dịch và giải độc các liệu pháp toàn bộ plasma
158,PARAGONIMUS AFRICANUS,"Giun dẹp, gây nhiễm trùng phổi",
159,PARAGONIMUS WESTERMANI D=0,"383 phổi sán, Nó có thể gây ra một hơi cấp cho bệnh viêm mạn tính của phổi",
160,PERIARTHERITIS NODOSA,"Ảnh hưởng đến hệ thần kinh trung ương, gây ra những thay đổi cảm giác thường ảnh hưởng đến thận hoặc tim có thể mệt mỏi, sụt cân, suy nhược, đau bụng, chán ăn, đau cơ và khớp bị mòn",
161,PENICYLLIUM CAMANBERTI,Nấm,
162,PENICYLLIUM ROCOVEFORTI,"Vi khuẩn, có thể gây ra nhiễm trùng trong ruột và bộ phận sinh dục",
163,PENICYLLIUM NOTATUM,Nấm,
164,PENICYLLIUM FRECVENTANS,Nấm,
165,PERESISTENT HEPATITIS,"Mãn tính, viêm nhẹ lâu dài của gan.",
166,PHARYNGITIS,Viêm họng.,
167,PITYROSPORUM ORBICULARE,Nhiễm trùng,
168,PLASMODIUM FALCIPARUM,Sốt rét,
169,PLASMODIUM VIVAS,Sốt rét,
170,PSEUDOMONAS AERUGINOSA,"Mầm bệnh có thể gây ra nhiễm trùng đường tiết niệu, hoặc độc tố huy hoại phế quãn",
171,POLYPUS,Cục u mỡ trên niêm mạc,
172,POLIPOID GASTRITIS,Gây viêm và tổn thương các niêm mạc.,
173,POLYPUS,U san hô,
174,POLLIOMMYELITIS - INJEEL,"HEEL Bại liệt - một loại virus ảnh hưởng đến vận động, sau đó các triệu chứng bệnh bao gồm nhiệt độ, buồn nôn, đau đầu, đau bụng, cứng khớp và đôi khi lưng và chân đau.",
175,PNEUMOCYSTIS CARINII,"nấm, có thể gây nhiễm trùng phổi ở những người có hệ miễn dịch yếu.",
176,PNEU-MOCOCCINUM,"Vi khuẩn có thể gây nguy hiểm cho trẻ em và người già có hệ miễn dịch yếu, có thể gây ra căn bệnh rất ngat ngheo với những hậu quả nghiêm trọng. Nhu viêm tai giữa, viêm phổi, viêm màng não, vv",
178,PROSTATITIS,ZVĚTŠENÁ PROSTATA,
179,PERIARTHERITIS NODOSA,"Bệnh tim mạch nơi có thể làm hỏng các mạch vừa và nhỏ và tĩnh mạch. Nó có thể gây ra đau bụng, mệt mỏi, chán ăn, sốt, đau khớp, yếu cơ.",Giải độc Alveo
180,PSEUDOMONAS AERUGINOSA,Một loại Vi khuẩn.,
181,PROCTITIS,"Viêm niêm mạc trực tràng, bệnh viêm ruột.",Aloe
182,PYELONEPHRITIS,Nhiễm trùng đường tiết niệu,
183,RADICULITIS,"Đau dây thần kinh hông, lưng dưới",
184,REOVIREN,"Virus có thể gây tiêu chảy, viêm ruột",
185,RESPIRATORISH,"VIRUS, gây ho, viêm mũi, cảm lạnh",
186,RHINITIS,Niêm mạc bị nhiễm virus giảm độc lực,
187,ROTAVIRUS,Virus phá màng nhầy của hệ thống tiêu hóa có thể gây tiêu chảy,
188,EXUDATIVE SEROUS SINOVITIS,Chứng Synovitis với tràn dịch lớn dịch nonpurulent.,
189,SCAPULARHUMERAL PERIARTHRITIS,bệnh viêm và thoái hóa của các mô sợi của khớp vai,
190,SCLERODERMA,Đóng băng da và nội tạng.,
191,SCOPULARIOPSIS BREVIC,Vi sinh vật,
192,SEBORRHOEA,"Vấn đề da, tăng sản xuất bã nhờn và mụn trứng cá: Tư vấn giải độc ruột.",
193,SCHISTOSOMA HAEMATOBIUM,"ký sinh trùng. gây nhiễm trùng ở đường tiết niệu, nó là ung thư nguy hiểm đó có thể gây ra ung thư bàng quang.",
194,SHORTSIGHTEDNESS,Cận thị,
195,SINUSITIS,Viêm xoang,
196,SIGMOIDITIS,"Viêm hoặc nhiễm trùng ở đại tràng. Các triệu chứng bao gồm đau bụng, đặc biệt là ở phía bụng dưới.","nên dùng Aloe, chất xơ và Herb,"
197,SHIGELLA DYSENTERIAE,Vi khuẩn CÓ THỂ CHO KẾT QUẢ tiêu chảy,
198,SHIGELLA FLEXNER,Vi khuẩn CÓ THỂ CHO KẾT QUẢ tiêu chảy,
199,STOMACH ULCER DISEASEM,"Loét (viêm dạ dày, tổn thương niêm mạc)",
200,SPIROMETRA ERINACEI,sán xơ mít,
201,STREPTOCOCCUS AGALACTIA,có thể gây ra nhiễm trùng ở bộ phận sinh dục và nhiễm trùng đường tiết niệu,
202,STREPTOCOCCUS MITTIS,"Nguyên nhân viêm, sốt thấp khớp, ảnh hưởng đến các khớp, thận, tim, van tim",
203,STREPTOCOCCUS VIRIDANS,Vi khuẩn gây viêm nhieu bộ phận khác nhau trong cơ thể,
204,STREPTOCOCCUS LACTIS,"Nguyên nhân viêm, sốt thấp khớp, ảnh hưởng đến các khớp, thận, tim, van tim",
205,SCOPULARIOPSIS BREVIC,Nấm,
