id,name,description,recommendation
206,STRONGYLOIDES STERCORALIS,"Ký sinh trùng, giun tròn, sống trong ruột, chung có thể chui vào phổi",
207,STAPHILOCOCCUS - STAFYLOKOK SUBAORTAL STENOSIS,"Thu hẹp tâm thất, khuyến nghị Omega 3",
208,SURAL ULCER,"Loét tĩnh mạch, có thể ảnh hưởng đến đau gót ở bàn chân.",
209,TAENIA SAGINATA,"cuộc sống sán dây ở ruột non, có thể gây đau bụng, buồn nôn, suy nhược, sụt cân, tiêu chảy, táo bón",
210,THROMBOPHLEBITIS,"Viêm tĩnh mạch, huyết khối",
211,TOXICOALLERGIC ARTHRITIS,"Các bệnh về khớp, khuyến cáo điều trị plasma, giải độc, trà nang luong, omega 3",
212,TONSILLITIS,"Viêm amiđan. Triệu chứng: đau họng, đỏ, amidan sưng, đau trong khi nuốt, sốt cao, ho, đau đầu, mệt mỏi, các đốm trên amiđan, sưng hạch bạch huyết (tuyến) trong cổ, đau trong tai hoặc cổ họng, buồn nôn",
213,TRACHEITIS,Viêm khí quản,
214,TRICHINELLA NATIVA,Tuyến trùng tấn công niêm mạc của ruột non,
215,TRICHINELLA NELSONI,"ký sinh trùng, ấu trùng xâm nhập vào các mô cơ. Một số triệu chứng bao gồm sốt, đau cơ, mệt mỏi và phù nề",
216,TRICHINELLA SPIRALIS,Ký sinh trùng,
217,TRICHINELLA BRITOVI,"ký sinh trùng gây sốt, ớn lạnh, nhức đầu, đổ mồ hôi dữ dội, buồn nôn, nôn mửa và tiêu chảy sau khi xâm nhập vào các cơ bắp gây đau cơ và có thể phải chịu những biến chứng nghiêm trọng, biến chứng tim mạch và nhịp tim không đều, chóng mặt, rối loạn thị giác, biến chứng hô hấp",
218,TRICHOPYTHON RUBRUM,là một loại nấm da,
219,TRYPANOSOMA CRUZI,Ký sinh trùng,
220,TOXIC HEPATITIS,Độc tố trong gan.,"giải độc gan, cây lô hội"
221,PAROXYSMAL TACHYCARDIA,"Tăng nhịp tim, có thể bị giảm sút mặc vật lý. ","Khuyến nghị:
omega 3"
222,TRICHOCEPHALUS TRICHIURUS,Ký sinh trùng gây nhiễm trùng ruột non.,
223,URETHRITIS,viêm niệu đạo,
224,UREAPLASMA UREALITICUM,"Vi khuẩn trong hệ thực vật âm đạo, có thể gây nhiễm trùng đường tiết niệu",
225,VARICOUS VEINS,Dễ bị giãn tĩnh mạch,
226,VASCULOMOTOR RHINOPATHY,Co thắt hay giãn nở của các mạch máu liên quan đến dây thần kinh và cơ bắp,
227,CLADOSPORIUM HERBARUM,Nấm,
228,HYPERESTROGENISM,Dư estrogen.,Thải độc
